name,price,description,imgurl
"TianWlio Refreshing Hand Sanitizer Gel, Washless Hand Soap Gel, Super-Large Capacity Household Cleaning Gentle Hydrating Hand Sanitizer Soothing Gel,Non-irritating,Pump Bottle 300ml",,"99.99% Effective:This hand sanitizer is the perfect solution for hand hygiene at home, the office, or while you travel. It stops the transition of dirty stuff and cleanses your skin.Kills more than 99.99%																								 							Moisturizing Function: Perfect for frequent use. Mild formula is free of parabens, phthalates, preservatives and harsh ingredients; so it does not dry out or irritate skin. Hands feel soft, even after many uses.																								 							Super-large Capacity Hand Sanitizer: super-large capacity hand sanitizer for household use, can be packed in a separate container and then packed into a backpack for easy carrying.																								 							Rinse-Free:With this no rinse hand sanitizer, you don't need to wash your hands at all, and you can use it on the go! Better yet, it won’t leave a sticky or tacky residue like other hand sanitizers.																								 							Good for Your Health:None of the nasty chemicals you find in conv",https://images-na.ssl-images-amazon.com/images/I/41VGWuKiuzL._SS40_.jpg
"MNLOS Refreshing Hand Sanitizer Gel, Washless Hand Soap Gel, Capacity Household Cleaning Gentle Hydrating Hand Sanitizer Soothing Gel,Non-irritating,Pump Bottle 3pc/50ml",,"【99.99% Effective】--- This hand sanitizer is the perfect solution for hand hygiene at home, the office, medical facilities or while you travel. It stops the transition of dirty stuff and cleanses your skin.Kills more than 99.99%																								 							【Disposable Hand Sanitizer】--- The hand cleaner is an Non-irritating Refreshing Hand Sanitizer that kills dirty stuff on contact! This clearner formula stops the spread of dirty stuff to keep your family safe. Safe for babies.																								 							【Moisturizing Function】--- Gentle and non-irritating, does not hurt the skin, moisturizing your hand skin.																								 							【Rinse-Free】--- With this no rinse hand sanitizer, you don't need to wash your hands at all, and you can use it on the go! Better yet, it won’t leave a sticky or tacky residue like other hand sanitizers.																								 							【Good for Your Health】 - None of the nasty chemicals you find in conventional hand sanitizers, but just as effective!Alcohol free hand sanitizer disinfectant, protecting your from harmful, it also leaves them feeling soft and smooth.",https://images-na.ssl-images-amazon.com/images/I/517Haw-5goL._SS40_.jpg
Hand Sanitizer - 64 OZ,,"Non-gel, thin formula																								 							Non-sterile, topical solution																								 							Non-dispensing cap. Packaging may vary																								 							Formulation recommended by World Health Organization																								 							In stock, shipping in 24 hours. Proudly Made in USA",https://images-na.ssl-images-amazon.com/images/I/418D6-zZldL._SS40_.jpg
"TianWlio Refreshing Hand Sanitizer Gel, Washless Hand Soap Gel, Super-Large Capacity Household Cleaning Gentle Hydrating Hand Sanitizer Soothing Gel,Non-irritating,Pump Bottle 50ml+260ml",,"99.99% Effective:This hand sanitizer is the perfect solution for hand hygiene at home, the office, or while you travel. It stops the transition of dirty stuff and cleanses your skin.Kills more than 99.99%																								 							Moisturizing Function: Perfect for frequent use. Mild formula is free of parabens, phthalates, preservatives and harsh ingredients; so it does not dry out or irritate skin. Hands feel soft, even after many uses.																								 							Super-large Capacity Hand Sanitizer: super-large capacity hand sanitizer for household use, can be packed in a separate container and then packed into a backpack for easy carrying.																								 							Rinse-Free:With this no rinse hand sanitizer, you don't need to wash your hands at all, and you can use it on the go! Better yet, it won’t leave a sticky or tacky residue like other hand sanitizers.																								 							Good for Your Health:None of the nasty chemicals you find in conv",https://images-na.ssl-images-amazon.com/images/I/414jVLGdMoL._SS40_.jpg
"Whear 50ml Pocket Size Hand Sanitizer Gel,Portable No Rinse Hand Soap Gel,Wash-Free Cleaner Moisturizing Hand Sanitizer Soothing Gel(A-1Pcs/B-2Pcs/C-3Pcs,Travel Size) (C)",,"This fits your .             Make sure this fits                by entering your model number.            P.when(""ReplacementPartsBulletLoader"").execute(function(module){ module.initializeDPX(); })																 							ி【Protection Function】This hand sanitizer is the perfect solution for hand hygiene at home, the office, or while you travel. It stops the transition of dirty stuff and cleanses your skin.Kills more than 99.99%.																								 							ி【Moisturizing Function】Perfect for frequent use. It does not dry out or irritate skin. Hands feel soft, even after many uses.																								 							ி【Rinse-Free】With this no rinse hand Gel, you don't need to wash your hands at all, and you can use it on the go! Better yet, it won’t leave a sticky or tacky residue like other hand Gel.																								 							ி【Good for Your Health 】None of the nasty chemicals you find in conventional hand Gel, but just as effective! protecting your from harmful, it also leaves them feeling soft and smooth.																								 							ி【Quality Service】Please read the size details carefully before ordering, If you have any problems, please send a message to us, We will answer your questions within 24 hours.",https://images-na.ssl-images-amazon.com/images/I/517Haw-5goL._AC_US40_.jpg
"DISNEY Portable Hand Sanitizer with Holder - Travel Sized Flip Cap Bottles - Clip on Backpacks - Refillable - ( Pair 1 Mickey & 1 Minnie, 2)",,"ADORABLE MICKEY & MINNIE MOUSE HOLDERS attach to backpacks, purses, belt loops, strollers and more. Take Mickey and Minnie anywhere!																								 							INSTANTLY KILLS GERMS strong anti-bacterial hand sanitizer without the harsh smell with a refreshing White Citrus scent that leaves hands smelling great!																								 							ENHANCED WITH ALOE and other skin-nourishing agents that will leave your hands feeling smooth and moisturized.																								 							RESUSABLE AND REFILLABLE each holder contains 1oz bottle of antibacterial instant hand sanitizer. Use again and again! (Refills sold separately)																								 							30 DAY MONEY BACK GUARANTEE! As a growing small business, we understand how important each and every purchase is, so your happiness is our #1 concern. If you don’t love the Disney Hand Sanitizers, we’ll refund you 100% of your money, no questions asked.",https://images-na.ssl-images-amazon.com/images/I/51IsARBghoL._SS40_.jpg
Disposable Hand Sanitizer Gel Liquid No-wash Hand Soap Hand Cream Portable No-wash 80ML/100ML Free Foaming Hand Sanitizer Pump No Rinse Safe & Health Hand Soap Gel Clear 100ML,,"✿【Function】- It can effectively and quickly kill microorganisms etc.Delicate and non-irritating, it does not damage the skin, it has a water-repellent and moisturizing function.																								 							✿【Features】- Gel texture, you can easily control the quantity.																								 							✿【How to Use】- Put some gels on your palms and thoroughly spread on both hands, without water or towel, rub into skin until dry.																								 							✿【Applications】- Use it in the office, home, car, school or other places where you need to clean your hands quickly.																								 							✿【Note】- For external use only! Not eating! Keep out of children! please cautions!",https://images-na.ssl-images-amazon.com/images/I/41Ju69CLSbL._AC_US40_.jpg
Portable Hand Sanitizer Gel 50mlx 3 Pack with 1 pcs Silicone Holder-Hand Soap Travel Size Antibacterial Hand Sanitizer Moisturizing Refreshing Gel Sanitizing Instant Hand Sanitizer Gel,,,https://images-na.ssl-images-amazon.com/images/I/51G-QS77YDL._AC_US40_.jpg
"Honestyivan 300ml Large Capacity No-Wash Hand Sanitizer Gel, Refreshing Quick-Dry Hand Soap Gel, Household Cleaning Gentle Hydrating Rinse Free Hand Lotion, Non-Irritating, Pump Bottle",,"This fits your .             Make sure this fits                by entering your model number.            P.when(""ReplacementPartsBulletLoader"").execute(function(module){ module.initializeDPX(); })																 							✅[99.99% Effective]: Outdoors, after touching something else, and before and after meals. If you are in an environment without water, you can use disposable hand sanitizer to prevent the spread of dirty things and ensure the health of you and your family.																								 							✅[Moisturizing Function]: Gel texture, Gentle, No-Irritating, does not harm the skin, has water retention and moisturizing function, does not make the skin too dry.																								 							✅[300ML Large Capacity]: 300ML super-large capacity hand sanitizer, can be packed in a separate container and then packed into a backpack for easy carrying, enough to use for a long time.																								 							✅[How To Use]: Wet your hands with an appropriate amount (2-3 ml) of the product, and rub it for 15 seconds until the liquid covers your hands. Gently wash the dirt and wait for it to dry. Do not rinse with water. With this rinse free hand sanitizer that doesn't require rinsing, you can use it in environments without water.																								 							✅[Contact Us]: If you have any questions, please feel free to contact us. We will reply you within 24 hours and do our best to solve the problem for you.",https://images-na.ssl-images-amazon.com/images/I/41Dbr6SHidL._AC_US40_.jpg
5PC Portable Refreshing Hand Soap Spray - Antibacterial Instant Skin Cleansing Disposable Hand Sanitizer Spray Effective 99.99% Bacteriostatic Spray For Adults & Kids Alcohol-Free (60ml),,"Help your family and the people you care about to keep healthy with our Hand Sanitizer Gels																								 							Advantage 1 of Hand Sanitizers Gel: Skin conditioning agent that preserves moisture on the skin and provides moisturization																								 							Advantage 2 of Hand Sanitizers Gel: Active ingredient that helps eliminate illness-causing germs on hands																								 							Advantage 3 of Hand Sanitizers Gel: Improves skin health by promoting moisturization and spreading of the formula across the skin surface																								 							Advantage 4 of Hand Sanitizers Gel: Ingredient that creates a skin friendly pH and makes formula thicken for better skin coverag",https://images-na.ssl-images-amazon.com/images/I/417YD18QcnL._SS40_.jpg
"WQIY Hand Sanitizer, Hand Soap Antibacterial, 65ml Antibacterial Portable Quick-Drying Refreshing Hand Sanitizer",,"【Usage】: squeeze proper amount of hand washing liquid into the palm, rub your hands together until your hands dry, and do not need to rinse with water.																								 							【99.99% Effective】--- This hand sanitizer is the perfect solution for hand hygiene at home, the office, or while you travel. It stops the transition of dirty stuff and cleanses your skin.Kills more than 99.99%																								 							【Moisturizing Function】--- Perfect for frequent use. Mild formula is free of parabens, phthalates, preservatives and harsh ingredients; so it does not dry out or irritate skin. Hands feel soft, even after many uses.																								 							【Good for Your Health】 - None of the nasty chemicals you find in conventional hand sanitizers, but just as effective! protecting your from harmful, it also leaves them feeling soft and smooth.																								 							【Satisfaction Guarantee】: We're proud of our products. If you aren't satisfied, we'll refund you for any reason within three month of purchase. Only on WQIY Brand.",https://images-na.ssl-images-amazon.com/images/I/31-O2X%2BeW9L._AC_US40_.jpg
"Starcast 75% Hand-Sanitizer Gel,1 Bottle-Kills 99.99% Germs, Long-Lasting Antibacterial Quick Drying Liquid Hand-Soap, No Water Required （Net Content 500 ml）",,"Because of post office staff reduction, we need 15-20 days for delivery. Amazon's estimated delivery date is for reference only.(In principle, returns are not allowed, and we will strictly control the quality of the products. Due to the severity of the epidemic, the purchase cost may increase at any time)																								 							Gentle and non-irritating, hand wash formula that is Gentle on skin and Guaranteed, it does not hurt the skin, has water-holding and moisturizing function. For Your family to love, Safe for babies.																								 							Throw it in your purse, backpack, briefcase, beach bag and always have a way to keep your hands clean. Use it at your office, home, in your car, school or anywhere else you need to quickly clean your hands.																								 							Each bottle container includes a convenient flip cap to protect your personal items from leaks, spills or drops.																								 							Antibacterial Protection that you and Your family can trust in a Convenient ; Always be in stock to protect against nasty germs, Kills 99.9% of germs without water (Bacteria encountered in houseHold settings).",https://images-na.ssl-images-amazon.com/images/I/41wRbZVT2sL._AC_US40_.jpg
"XLnuln Refreshing Hand Sanitizer Gel, Washless Hand Soap Gel, Hydrating Hand Sanitizer Soothing Gel,Non-irritating,Pump Bottle (300 ML)",,"Kills 99.99% of many common harmful germs and bacteria in as little as 15 seconds																								 							Surface throughout useing to protecting your from harmful bacteria																								 							Convenient pump for easy dispensing																								 							Fits on any desk, counter or sink.School supply essential for classrooms																								 							MORE CHOICES: Click ""XLnuln"" for more new fashion style. Please recognize our brand name ""XLnuln"", you can get the best products and services.We offer free flexible return and exchange services.",https://images-na.ssl-images-amazon.com/images/I/41jkBOE7kaL._AC_US40_.jpg
"Refreshing Hand Sanitizer Gel, Washless Hand Soap Gel, 300ML Super-Large Capacity, Long-Lasting Speed Dry Hand Lotion",,"✅【ATTENIONG】Please confirm the expected arrival time before purchase. After you place the order, we will ship it within two working days. Our store sells hand sanitizer, puzzles, diamond paintings, shoes and so on, welcome to buy!																								 							✅【99.99% Effective】--- This hand sanitizer is the perfect solution for hand hygiene at home, the office, or while you travel. It stops the transition of dirty stuff and cleanses your skin.Kills more than 99.99%																								 							✅【Moisturizing Function】--- Perfect for frequent use. Mild formula is free of parabens, phthalates, preservatives and harsh ingredients; so it does not dry out or irritate skin. Hands feel soft, even after many uses.																								 							✅【Easy to Transport】 You can easily control the quantity. Small size, easy to carry. Do not wash with water, easy to save water.（Take an appropriate amount (2-3 ml) of product to moisten your hands and rub for 15 seconds until the liquid covers your hands, wait for drying）																								 							✅【Rinse-Free】--- With this no rinse hand sanitizer, you don't need to wash your hands at all, and you can use it on the go! Better yet, it won’t leave a sticky or tacky residue like other hand sanitizers.																								 							✅【Good for Your Health】 - None of the nasty chemicals you find in conventional hand sanitizers, but just as effective! protecting your from harmful, it also leaves them feeling soft and smooth.","https://images-na.ssl-images-amazon.com/images/I/41GqlovSjIL._AC_SR38,50_.jpg"
"Hand Sanitizer Gel 32 oz (1 Liter)- Original Scent-No Washing, Quick-Drying, Easy to Use, Mild Hand Protection- Made In USA",,"Made in USA-We will be Donating Hand Sanitizers to those in need, 1 for every 2 that is purchased. Contains 62.5% Ethyl Alcohol																								 							No washing, quick-drying, easy to use, mild hand protection. It can effectively and quickly wash hands																								 							Gentle and non-irritating, does not hurt the skin, has water-holding and moisturizing function																								 							Bottles may vary: shape, color, cap (with or without pump)																								 							Gel texture, you can easily check the quantity Simple to use and clean. Perfect to use at the office, restaurant, toilets in public places,school, shopping mall etc",https://images-na.ssl-images-amazon.com/images/I/31NVMSqiVkL._SS40_.jpg
"Beppter Water-Free Hand Sanitizer, Hand Sanitizer Travel Size, Hand Soap - Defense 24 Hours",,"➤➤Faster logistics, can be reached in 7-15 days.																								 							➤➤Small size, easy to carry.																								 							➤➤Maintaining clean hands is very important.																								 							➤➤The hand sanitizer will leave your hands clean while smelling great.																								 							➤➤Use it at your office, home, in your car, school or anywhere else you need to quickly clean your hands.","https://images-na.ssl-images-amazon.com/images/I/311PHGVMA3L._AC_SR38,50_.jpg"
"Hand,Sanitizers- Gel,Bottle Portable No-Wash Hand Soap Gels Home Office Hand Sanitizers 60ML (60ml)",,"This fits your .             Make sure this fits                by entering your model number.            P.when(""ReplacementPartsBulletLoader"").execute(function(module){ module.initializeDPX(); })																 							✅【INSTANT HAND CLEANER】— The hand cleaner is an Non-irritating Refreshing Hand Spray Hand Sanitizer that kills dirty stuff on contact! This clearner formula stops the spread of dirty stuff to keep your family safe. Safe for babies.																								 							✅【KILLS 99% OF DIRTY STUFF】— This hand sanitizer is the perfect solution for hand hygiene at home, the office, medical facilities or while you travel. It stops the transition of dirty stuff and cleanses your skin.																								 							✅【Easy to Transport】 You can easily control the quantity. Small size, easy to carry. Do not wash with water, easy to save water.（DIRECTIONS—Take an appropriate amount (2-3 ml) of product to moisten your hands and rub for 15 seconds until the liquid covers your hands, wait for drying and do not wash with water. ）																								 							✅【NON-STICKY FORMULA】Keep clean hands and health for kids. Better yet, it won’t leave a sticky or tacky residue like other hand sanitizers. Make you easily can keep clean and tidy anytime and anywhere. It is an interesting washing product, environmental protection, travel products. A good partner for your health.																								 							✅【 CARE YOUR HAND】Soft and non-irritating, does not hurt the skin, has a water retention and hydration function. Small size, easy to carry. Gel texture, you can easily control the amount. The Hand Sanitizer Gel is perfect for all occasions, this Hands Sterilizer Gel is convenient and easy to use. These size bottles are perfect and practical to carry in school bags, bags, travel bags, etc.",https://images-na.ssl-images-amazon.com/images/I/31HzDZ4QJ0L._AC_US40_.jpg
"HollyBeth Organics – Organic Hand Sanitizer with Lavender, Citrus & Peppermint Essential Oils, 2 fl oz",,"Lavender, Citrus & Peppermint",https://images-na.ssl-images-amazon.com/images/I/31H%2B3sTcpAL._SS40_.jpg
"Artnaturals Hand Sanitizer Gel Alcohol Based (1 Pack x 8 Fl Oz / 220ml) Infused with Jojoba Oil, Alovera Gel & Vitamin E - Unscented Fragrance Free Sanitize",,"CONTAINS 62.5% ETHYL ALCOHOL: A must have for cold to stop the spread of illness causing germs.																								 							SAFE FOR KIDS: Great bulk hand sanitizer pack for parents and teachers. Pure natural ingredients are gentle enough for children’s sensitive skin, while still killing germs. Great to use at home or in your classroom where cold germs lurk.																								 							MOISTURIZING & GENTLE ON SENSITIVE SKIN: Pure natural ingredients deeply nourish skin. Free from the harshest synthetic chemicals used on other brands that irritate sensitive skin. Our nutrient:rich hand sanitizer formula includes aloe vera, vitamin E and jojoba oil to leave your skin germ:free and feeling silky smooth.																								 							COLD SEASON PROTECTION: A year:round must have that’s even more important during cold. Protect you and your family from the latest bug going around. Vital hygiene tool for teachers, gym enthusiasts, communal work areas, sales people and other jobs that put you in contact with the public.																								 							SCENT FREE w/ALOE VERA: ArtNaturals Hand Sanitizer 8 Fl Oz. bottles: Scent Free, infused with Alovera Gel, Jojoba Oil & Vitamin E. Convenient hand sanitizer dispenser bottles are also great for personal use. Keeping a bottle handy in your home, office, car and bag is a great preventative measure during cold season.",https://images-na.ssl-images-amazon.com/images/I/418tv2kEgsL._AC_US40_.jpg
"Medically Minded Hand Sanitizer Gel, 70% Ethyl Alcohol, Antimicrobial with Vitamin E",$11.99 ,"70 % Ethyl Alcohol Antimicrobial Hand Gel for Sanitization																								 							Vitamin E & Moisturizer added for smooth hands																								 							3.38 oz / 100 ml																								 							Eliminates 99.9% of bacteria and viruses when applied to skin																								 							Great for the Car, Purse, Gym Bag, Golf Bag & More!",https://images-na.ssl-images-amazon.com/images/I/41FoWrd7DVL._SS40_.jpg
Bath Body Works Pool Float Sloth Pocketbac Clip Holder,,"This fits your .             Make sure this fits                by entering your model number.            P.when(""ReplacementPartsBulletLoader"").execute(function(module){ module.initializeDPX(); })																 							Bath Body Works Pool Float Sloth Pocketbac Clip Holder																								 							Pocketbac Sold Separately",https://images-na.ssl-images-amazon.com/images/I/316S51qdQTL._AC_US40_.jpg
"MONISE Disposable No-wash Hand Sanitizer Spray Travel Size, Portable Pump Bottle Quick-drying Cleaner Hand Soap (100ml× 3pcs)",,"✪Limited stock, buy as soon as possible.																								 							✪Small size, easy to carry.																								 							✪Maintaining clean hands is very important.																								 							✪The hand sanitizer will leave your hands clean while smelling great.																								 							✪Use it at your office, home, in your car, school or anywhere else you need to quickly clean your hands.",https://images-na.ssl-images-amazon.com/images/I/41A-pGnQn1L._SS40_.jpg
Go All Out Adult Toilet Paper Hand Sanitizer 2020 Presidential Ticket T-Shirt,,"Proudly printed in the USA																								 							5.6-ounce, 50/50 cotton/poly (preshrunk)																								 							Seamless body with set-in sleeves																								 							Coverstitched on front neck","https://images-na.ssl-images-amazon.com/images/I/41AxB9qn0hL._AC_SR38,50_.jpg"
XLnuln 2PC Hand Soap Antibacterial Liquid Hand Soap Portable Hand Soap Large Capacity Disposable Hand Sanitizer 100/300ML,,"Keeping hands clean is important to prevent the spread of bacteria.																								 							Quickly kill microorganisms on your hands without irritating or drying your skin.																								 							Hand sanitizer will keep your hands clean and at the same time emit a great smell.																								 							Hand sanitizer will make your hands feel smooth and fresh.																								 							Use it in the office, home, car, school or other places where you need to clean your hands quickly.",https://images-na.ssl-images-amazon.com/images/I/41TGpNmYu%2BL._AC_US40_.jpg
"Whear 300ML Refreshing Hand Sanitizer Gel, Washless Hand Soap Gel, Super-Large Capacity Household Cleaning Gentle Hydrating Hand Sanitizer Soothing Gel,Non-irritating",,"This fits your .             Make sure this fits                by entering your model number.            P.when(""ReplacementPartsBulletLoader"").execute(function(module){ module.initializeDPX(); })																 							【Protection Function】99.99% Effective:This hand sanitizer is the perfect solution for hand hygiene at home, the office, or while you travel. It stops the transition of dirty stuff and cleanses your skin.Kills more than 99.99%																								 							【Moisturizing Function】--- Perfect for frequent use. it does not dry out or irritate skin. Hands feel soft, even after many uses.																								 							【Rinse-Free】--- With this no rinse hand Gel, you don't need to wash your hands at all, and you can use it on the go! Better yet, it won’t leave a sticky or tacky residue like other hand Gel.																								 							【Good for Your Health】 - None of the nasty chemicals you find in conventional hand Gel, but just as effective! protecting your from harmful, it also leaves them feeling soft and smooth.																								 							【Quality Service】- Please read the size details carefully before ordering, If you have any problems, please send a message to us, We will answer your questions within 24 hours.",https://images-na.ssl-images-amazon.com/images/I/41SkVEwGjSL._AC_US40_.jpg
