name,price,description,imgurl
"Artnaturals Hand Sanitizer Gel Alcohol Based (1 Gallon x 128 Fl Oz / 3785ml) Infused with Jojoba Oil, Alovera Gel & Vitamin E - Unscented Fragrance Free Sanitize",$54.95 ,"CONTAINS 62.5% ETHYL ALCOHOL: A must have for cold to stop the spread of illness causing germs.																								 							SAFE FOR KIDS: Great bulk hand sanitizer pack for parents and teachers. Pure natural ingredients are gentle enough for children’s sensitive skin, while still killing germs. Great to use at home or in your classroom where cold germs lurk.																								 							MOISTURIZING & GENTLE ON SENSITIVE SKIN: Pure natural ingredients deeply nourish skin. Free from the harshest synthetic chemicals used on other brands that irritate sensitive skin. Our nutrient:rich hand sanitizer formula includes aloe vera, vitamin E and jojoba oil to leave your skin germ:free and feeling silky smooth.																								 							COLD SEASON PROTECTION: A year:round must have that’s even more important during cold. Protect you and your family from the latest bug going around. Vital hygiene tool for teachers, gym enthusiasts, communal work areas, sales people and other jobs that put you in contact with the public.																								 							SCENT FREE w/ALOE VERA: ArtNaturals Hand Sanitizer 8 Fl Oz. bottles: Scent Free, infused with Alovera Gel, Jojoba Oil & Vitamin E. Convenient hand sanitizer dispenser bottles are also great for personal use. Keeping a bottle handy in your home, office, car and bag is a great preventative measure during cold season.",https://images-na.ssl-images-amazon.com/images/I/41doy1ULWrL._SS40_.jpg
BushKlawz Eco Finest 5 Pack of 2 oz Rinse Free 75% Alcohol Instant Hand Sanitizer (5xPack of 2oz) Washless Rinse Free Hand Soap Gel,,"♕ FAST SHIPPING GET IT QUICKLY - BushKlawz is working tirelessly to pack and ship your orders quickly from our USA based warehouse in Georgia																								 							♕ 5 COUNT of Eco Finest BushKlawz Instant Hand Sanitizer Gel																								 							♕ CONTAINS 75% ETHYL ALCOHOL - More than the recommended percentage of Alcohol of 62% for hand sanitizer																								 							♕ GENTLE ON YOUR HANDS - With moisturizers and Vitamin E for easy application throughout the day																								 							♕ PORTABLE SIZE - Take it wherever you go, to the office, home, car, school or other places where you need to clean your hands quickly",https://images-na.ssl-images-amazon.com/images/I/51FWPpi4YSL._SS40_.jpg
"Toamen No-Wash Hand Sanitiser Gel 300ML, Rinse-Free Refreshing Hand Soap Gel to Instant Skin Cleanser Gel Disposable Hand Sanitizer Gel Effective 99.99% Skin Cleansing, Non-irritating, 300ML",,"This fits your .             Make sure this fits                by entering your model number.            P.when(""ReplacementPartsBulletLoader"").execute(function(module){ module.initializeDPX(); })																 							Package contains: 1 × 300ml hand sanitizer.																								 							INSTANT SANITIZER. This hand santizer quickly and effectively clean your hands without irritating or drying your skin.																								 							Effectively keeps your hands clean and at the same time emit a fresh smell, making your hands feel smooth and fresh.																								 							Use it in the office, home, car, school or other places where you need to clean, it is a portable hand sanitizer for you, very easy to carry out.																								 							Please do not hesitate to contact Toamens with any problems, we provide 24/7 responsive customer service. More products please pay attention to Toamens.",https://images-na.ssl-images-amazon.com/images/I/41TGpNmYu%2BL._AC_US40_.jpg
"Comix Hand Sanitizer Gel 16 Fl Oz /480ml Alcohol Based, Free Foaming Hand Sanitizer, No Rinse Foam Hand Soap Gel, Kid Friendly, L902",,"Comix 16Fl Oz hand sanitizers Gel with 75% Ethanol Alcohol based for home office, 1 bottle																								 							This hand sanitizer with 99.99% Effective is the perfect solution for hand hygiene at home, the office, or while you travel. It stops the transition of dirty stuff and clean your skin.																								 							This GEL will not hurt the skin, has water-holding and moisturizing function, hair gel, eyeglass cleaner, perfume, air freshener, and is very suitable for home/bedroom/bathroom to use. Portable to put in your bags																								 							With this no rinse hand sanitizer GEL, you don't need to wash your hands at all, and you can use it on the go! Better yet, it won’t leave a sticky or tacky residue like other hand sanitizers.																								 							Ship from China and pls kindly pay attention this hand sanitizer smell is pure Alcohol, no any other fragrance. Please do NOT buy if with Alcohol Allergic or ""don't like this smell""",https://images-na.ssl-images-amazon.com/images/I/41EvAWn2L%2BL._AC_US40_.jpg
Instant Hand Sanitize Gel - 3 Pack Value Size Advanced Natural Hand Sanitize Cleaner Portable Aloe Vera Moisturizer Packaging May Vary,$19.95 ,"KEEP YOUR HANDS CLEAN																								 							NON STICK FORMULA																								 							MADE IN USA",https://images-na.ssl-images-amazon.com/images/I/51nBi8bamsL._SS40_.jpg
"Aloe Vera Hand Purifying Gel - Cleansing and Waterless Wash - 100% Pure, Natural and Organic Protection for Body with Manuka Honey, Tea Tree, and Rosemary Oil - Moisturizing and Hypoallergenic (8oz)",$18.48 ,"BEST DEFENSE TO PROTECT YOUR SKIN: With the combined power of our natural ingredients like Witch Hazel Oil, Onion and Garlic Extract, Neroli Oil, Rosemary Oil, Irish Moss Extract, Oregano and Peppermint Oil. All of which has been known to be rich in antioxidant and has natural cleansing properties. 30 Day Money Back Guarantee. Love it in 30 Days or your Money Back.																								 							NATURAL AND ORGANIC ALOE GEL: Made with ingredients that will naturally cleanse, purify and protect your skin against harmful elements without harmful chemicals that may irritate your skin																								 							ALOE VERA BASED HAND AND SKIN PURIFYING GEL: Because the base is Aloe Vera, our hand purifying gel will eliminate unwanted harmful elements without drying your skin. being a well-known natural skin moisturizer, and collagen stimulator, aloe vera also contains powerful antioxidants.																								 							SAFE FOR KIDS AND BABIES: Because it is made with natural and organic ingredients, and does not contain alcohol, you don't need to worry about your kids' safety. It is safe and effective and has Tea Tree Oil which is known to protect your skin while being suitable to all types of skin. Our hand gel is hypoallergenic and safe even to the most sensitive skin!																								 							EASILY CLEAN AND PURIFY YOUR SKIN AND OTHER BODY PARTS WITHOUT USING SOAP AND WATER: For quick cleansing with gel pump. Formulated for rapid skin absorption. And because it contains Manuka Honey, which is known to keep the skin clean, it also balance the skin's pH level, shields your skin and it is a great emollient which softens the skin. Moisturize your skin while cleansing.",https://images-na.ssl-images-amazon.com/images/I/41IDvRqe0pL._SS40_.jpg
"Muse Hand Sanitizer gel, 8 ounce Kills 99.9% of germs",$9.89 ,"Instant Cleanse: Whether needing a quick cleanse before lunch or extra security after using soap, this hand sanitizer begins disinfecting at the point of contact and prevents the spread of bacteria.																								 							Safe Formula: Created with ingredients intended to rid the skin of germs, this non-irritating and gentle formula keeps the hands smooth.																								 							Rinse-Free: Whatever the desired amount needed to cover your hands, our non toxic hand sanitizer does not need to be rinsed. Simply rub the solution onto the front and back of your hands and let its antibacterial effects take over.																								 							Refreshing Feel: Containing over 60% denatured ethyl alcohol, your hands will feel an instant cooling effect that leaves you feeling instantly clean and refreshed.																								 							100% Cruelty Free: Never used or tested on animals, our antibacterial gel is made with quality and conscience.",https://images-na.ssl-images-amazon.com/images/I/419uech34XL._SS40_.jpg
Instant Hand Sanitize Gel - 3 Pack Value Size Advanced Natural Hand Sanitize Cleaner Portable Aloe Vera Moisturizer Packaging May Vary,,"KEEP YOUR HANDS CLEAN																								 							NON STICK FORMULA																								 							MADE IN USA",https://images-na.ssl-images-amazon.com/images/I/51cZrGQHZEL._SS40_.jpg
Waterless Hand Disinfectant Cleaning Gel - 2-Pk 8 fl oz Bottles,$18.99 ,"Waterless Hand Disinfectant Cleaning Gel - 2-Pk 8 fl oz Bottles																								 							Active Ingredient: 70% Ethyl Alcohol																								 							To use, simply apply to palms and rub in thoroughly until dry																								 							MADE IN THE USA and ships from the USA																								 							Please note, packaging/cap may vary slightly from image shown",https://images-na.ssl-images-amazon.com/images/I/41oEf1vjAPL._SS40_.jpg
"Durisan Travel Hand Sanitizer Alcohol-Free, Long-Lasting, No Odor, Non Toxic, 24 Hour Protection 18 Milliliter Set of 6 Assorted Colors",,,"https://images-na.ssl-images-amazon.com/images/I/416AIxZ89fL._SX38_SY50_CR,0,0,38,50_.jpg"
Hand Sanitizer 2oz - Made in USA by 4F - Fast Shipping - Moisturizing Alcohol-Free Antibacterial Hand Sanitizer - Long Lasting - Pet & Kid Safe - Non-Toxic - Kills 99.99% Bacteria - Fits In Pocket,,"NON-TOXIC: 4F won’t irritate or dry out skin. 4F Sanitizers are odorless and won’t damage tile, wood, carpet, or paint & more importantly your skin.																								 							USA MANUFACTURED: All 4F Products are packaged & Manufactured in USA																								 							KID & PET SAFE: Unlike Alcohol Based Hand Sanitizers, 4F WELLNESS Products are safe for the whole family whereas alcohol based products can be harmful for both the pets & kids.																								 							TRUSTED BRAND: 4F WELLNESS 2oz Sanitizer Kills 99.9% of Germs On Contact & Are MORE Powerful Than Alcohol Based Sanitizers. Every 4F Wellness Product Is Thoroughly Lab Tested To Ensure FDA Compliance.																								 							NON-DRYING: Alcohol Based products tend to dry out the skin, but not 4F Wellness Hand Sanitizer! 4F Products contain benzalkonium chloride (BZK) that are clinically proven to kill bacteria & keep the skin feeling smooth.",https://images-na.ssl-images-amazon.com/images/I/41huEKbg4HL._SS40_.jpg
"Artnaturals Alcohol Based Hand Sanitizer Gel (1 Pack 8 Fl Oz / 236ml) Infused with Jojoba Oil, Alovera Gel & Vitamin E - Unscented Fragrance Free Sanitize",$8.95 ,"CONTAINS 62.5% ETHYL ALCOHOL: A must have for cold to stop the spread of illness causing germs.																								 							SAFE FOR KIDS: Great bulk hand sanitizer pack for parents and teachers. Pure natural ingredients are gentle enough for children’s sensitive skin, while still killing germs. Great to use at home or in your classroom where cold germs lurk.																								 							MOISTURIZING & GENTLE ON SENSITIVE SKIN: Pure natural ingredients deeply nourish skin. Free from the harshest synthetic chemicals used on other brands that irritate sensitive skin. Our nutrient:rich hand sanitizer formula includes aloe vera, vitamin E and jojoba oil to leave your skin germ:free and feeling silky smooth.																								 							COLD SEASON PROTECTION: A year:round must have that’s even more important during cold. Protect you and your family from the latest bug going around. Vital hygiene tool for teachers, gym enthusiasts, communal work areas, sales people and other jobs that put you in contact with the public.																								 							SCENT FREE w/ALOE VERA: ArtNaturals Hand Sanitizer 8 Fl Oz. bottles: Scent Free, infused with Alovera Gel, Jojoba Oil & Vitamin E. Convenient hand sanitizer dispenser bottles are also great for personal use. Keeping a bottle handy in your home, office, car and bag is a great preventative measure during cold season.",https://images-na.ssl-images-amazon.com/images/I/418tv2kEgsL._SS40_.jpg
"NRUTUP Hand Sanitizer Gel, Washless Hand Soap Gel, 300ML Super-Large Capacity Household Cleaning Gentle Hydrating Hand Sanitizer Soothing Gel,Non-irritating,Pump Bottle",,"This fits your .             Make sure this fits                by entering your model number.            P.when(""ReplacementPartsBulletLoader"").execute(function(module){ module.initializeDPX(); })																 							✔♪【99.99% Effective】--- This hand sanitizer is the perfect solution for hand hygiene at home, the office, or while you travel. It stops the transition of dirty stuff and cleanses your skin.Kills more than 99.99%																								 							✔♪【Moisturizing Function】--- Perfect for frequent use. Mild formula is free of parabens, phthalates, preservatives and harsh ingredients; so it does not dry out or irritate skin. Hands feel soft, even after many uses.																								 							✔♪【300ML Super-large Capacity Hand Sanitizer】--- 300ML super-large capacity hand sanitizer for household use, can be packed in a separate container and then packed into a backpack for easy carrying.																								 							✔♪【Rinse-Free】--- With this no rinse hand sanitizer, you don't need to wash your hands at all, and you can use it on the go! Better yet, it won’t leave a sticky or tacky residue like other hand sanitizers.																								 							✔♪【Good for Your Health】 - None of the nasty chemicals you find in conventional hand sanitizers, but just as effective! protecting your from harmful, it also leaves them feeling soft and smooth.Keeping hands clean is important to prevent the spread of bacteria.",https://images-na.ssl-images-amazon.com/images/I/41SkVEwGjSL._AC_US40_.jpg
160 Proof Antibacterial Hand Sanitizer Alcohol Based (1 Gallon x 128 Fl Oz / 3785ml),,"Commercial Grade Antibacterial Hand Sanitizer																								 							Contains 80% Denatured Ethyl Alcohol (WHO and FDA recommended)																								 							Contains Glycerin to replace skin moisture that alcohol removes																								 							Contains Vitamin E to start the skin healing process																								 							Specially designed, this Hand Sanitizer dries quickly with no sticky residue",https://images-na.ssl-images-amazon.com/images/I/31tFnO6xpIL._SS40_.jpg
"Hand Sanitizer Gel+, 62% Organic Ethyl Alcohol, with Moisturizing Oleospheres, Kills 99.9% of Germs, FDA Regulated, Natural and Hypoallergenic, 2.0 Fl Oz",$5.00 ,"Manufactured and shipped from California with FDA regulated Drug Facts sheet.																								 							Earth Baby Hand Sanitizer Gel+ contains 62% Organic Ethyl Alcohol. For ethyl (ethanol) alcohol the CDC recommends that at least 60% alcohol for a hand sanitizer to be effective against germs. (For isopropyl alcohol the CDC recommends 70%.)																								 							Earth Baby uses Certified Organic & Natural Ingredients. Our essential oils revitalize skin with nutrative vitamins and minerals. You will love the relaxing spa-like scent from these natural essential oils.																								 							Oleospheres are unique only to Earth Baby! Our organic Oleospheres are derived from safflower oleosomes, a naturally occurring moisturizer, emulsifier, and emollient to combat dryness commonly associated with other hand sanitizers. This replaces several man-made ingredients found in other products with a single natural plant-based one instead. Our highly effective Oleospheres replaces the use of parabens, and pthalates and many other artificial ingredients.																								 							Our Hand Sanitizer Gel+ is ""Formulated Safe + Friendly"" in California by a Grandmother who has been formulating hair and skin products for other companies for over 40 years and decided carry her own line of product. Earth Baby is made with the best she could give her grandchildren. All our products are made with love in a certified FDA ISO 22716:2007 GMP facility.",https://images-na.ssl-images-amazon.com/images/I/31CE3OnUKOL._SS40_.jpg
3-Pack (8 oz bottles) Hand Sanitizer Gel with Aloe & Vitamin E (Kills 99.9% of Germs) by Germs by Gone,$29.99 ,"Hand Sanitizer Gel 8 Ounce																								 							Clean and Fresh																								 							Enriched with Aloe and Vitamin E																								 							Made in Canada",https://images-na.ssl-images-amazon.com/images/I/41TBICtuBqL._SS40_.jpg
"WQIY Hand Sanitizer, Hand Sanitizer Travel Size, Hand Soap",,"【Usage】: squeeze proper amount of hand washing liquid into the palm, rub your hands together until your hands dry, and do not need to rinse with water.																								 							【99.99% Effective】--- This hand sanitizer is the perfect solution for hand hygiene at home, the office, or while you travel. It stops the transition of dirty stuff and cleanses your skin.Kills more than 99.99%																								 							【Moisturizing Function】--- Perfect for frequent use. Mild formula is free of parabens, phthalates, preservatives and harsh ingredients; so it does not dry out or irritate skin. Hands feel soft, even after many uses.																								 							【Good for Your Health】 - None of the nasty chemicals you find in conventional hand sanitizers, but just as effective! protecting your from harmful, it also leaves them feeling soft and smooth.																								 							【Satisfaction Guarantee】: We're proud of our products. If you aren't satisfied, we'll refund you for any reason within three month of purchase. Only on WQIY Brand.",https://images-na.ssl-images-amazon.com/images/I/41SKJZi6GJL._AC_US40_.jpg
"Artnaturals Hand Sanitizer Gel Alcohol Based (2 Pack x 8 Fl Oz / 220ml) Infused with Jojoba Oil, Alovera Gel & Vitamin E - Unscented Fragrance Free Sanitize",$16.95 ,"CONTAINS 62.5% ETHYL ALCOHOL: A must have for cold to stop the spread of illness causing germs.																								 							SAFE FOR KIDS: Great bulk hand sanitizer pack for parents and teachers. Pure natural ingredients are gentle enough for children’s sensitive skin, while still killing germs. Great to use at home or in your classroom where cold germs lurk.																								 							MOISTURIZING & GENTLE ON SENSITIVE SKIN: Pure natural ingredients deeply nourish skin. Free from the harshest synthetic chemicals used on other brands that irritate sensitive skin. Our nutrient:rich hand sanitizer formula includes aloe vera, vitamin E and jojoba oil to leave your skin germ:free and feeling silky smooth.																								 							COLD SEASON PROTECTION: A year:round must have that’s even more important during cold. Protect you and your family from the latest bug going around. Vital hygiene tool for teachers, gym enthusiasts, communal work areas, sales people and other jobs that put you in contact with the public.																								 							SCENT FREE w/ALOE VERA: ArtNaturals Hand Sanitizer 8 Fl Oz. bottles: Scent Free, infused with Alovera Gel, Jojoba Oil & Vitamin E. Convenient hand sanitizer dispenser bottles are also great for personal use. Keeping a bottle handy in your home, office, car and bag is a great preventative measure during cold season.",https://images-na.ssl-images-amazon.com/images/I/41JBfG5CBKL._SS40_.jpg
"Toamen Instant Hand Sanitizer Travel Size No-Rinse Alcohol Free 50ML, Washless Disposable Hand Sanitizer Moisturizing Refreshing Hand Wash Soap Non-irritating Portable Hand Cleanser (2 Pcs)",,"This fits your .             Make sure this fits                by entering your model number.            P.when(""ReplacementPartsBulletLoader"").execute(function(module){ module.initializeDPX(); })																 							Package contains: 1/2 × 50ml hand sanitizer.																								 							INSTANT SANITIZER. This hand santizer quickly and effectively clean your hands without irritating or drying your skin.																								 							Effectively keeps your hands clean and at the same time emit a fresh smell, making your hands feel smooth and fresh.																								 							Use it in the office, home, car, school or other places where you need to clean, it is a portable hand sanitizer for you, very easy to carry out.																								 							Please do not hesitate to contact Toamens with any problems, we provide 24/7 responsive customer service. More products please pay attention to Toamens.",https://images-na.ssl-images-amazon.com/images/I/51tj5L1CiHL._AC_US40_.jpg
"Clisen 75% Alcohol Disinfectant Hand Sanitizer - Kills 99.99 Germs, Long-Lasting Anti-Bacterial Quick Drying Liquid Hand Soap MADE IN U.S",$4.65 ,"75 % Ethyl alcohol. Super concentrated. Only Need to Apply a little at time																								 							100 % Made in U.S.A (California) 2 months supply																								 							Please understand Sanitizer price changed Due to the Alcohol and Plastic bottles cost went up in U.S																								 							In Stock in U.S. 2-5 days deliver to your home																								 							Support U.S based Factory ! Only 70% alchohol or above can kill coronavirus !",https://images-na.ssl-images-amazon.com/images/I/31ptjPALeML._SS40_.jpg
Waterless (No Water Needed for Rinsing) Hand Cleanser (Unscented) - 2 pack,,"Natural Waterless Hand Cleanser																								 							Great For the Gym, School and Work																								 							Moisturizing Forumla Made With Aloe Vera																								 							Travel friendly and New Formula Contains Alcohol																								 							Pack of two",https://images-na.ssl-images-amazon.com/images/I/513ESXM-MfL._SS40_.jpg
"MNLOS Refreshing Hand Sanitizer Gel, Washless Hand Soap Gel, Capacity Household Cleaning Gentle Hydrating Hand Sanitizer Soothing Gel,Non-irritating,Pump Bottle 50ml+260ml",,"【99.99% Effective】--- This hand sanitizer is the perfect solution for hand hygiene at home, the office, medical facilities or while you travel. It stops the transition of dirty stuff and cleanses your skin.Kills more than 99.99%																								 							【Disposable Hand Sanitizer】--- The hand cleaner is an Non-irritating Refreshing Hand Sanitizer that kills dirty stuff on contact! This clearner formula stops the spread of dirty stuff to keep your family safe. Safe for babies.																								 							【Moisturizing Function】--- Gentle and non-irritating, does not hurt the skin, moisturizing your hand skin.																								 							【Rinse-Free】--- With this no rinse hand sanitizer, you don't need to wash your hands at all, and you can use it on the go! Better yet, it won’t leave a sticky or tacky residue like other hand sanitizers.																								 							【Good for Your Health】 - None of the nasty chemicals you find in conventional hand sanitizers, but just as effective!Alcohol free hand sanitizer disinfectant, protecting your from harmful, it also leaves them feeling soft and smooth.",https://images-na.ssl-images-amazon.com/images/I/414jVLGdMoL._SS40_.jpg
"WQIY 30ml Summer Fresh Jelly Candy Color Mini Hand Sanitizer, Hand Sanitizer Travel Size, Hand Soap",,"【Usage】: squeeze proper amount of hand washing liquid into the palm, rub your hands together until your hands dry, and do not need to rinse with water.																								 							【99.99% Effective】--- This hand sanitizer is the perfect solution for hand hygiene at home, the office, or while you travel. It stops the transition of dirty stuff and cleanses your skin.Kills more than 99.99%																								 							【Moisturizing Function】--- Perfect for frequent use. Mild formula is free of parabens, phthalates, preservatives and harsh ingredients; so it does not dry out or irritate skin. Hands feel soft, even after many uses.																								 							【Good for Your Health】 - None of the nasty chemicals you find in conventional hand sanitizers, but just as effective! protecting your from harmful, it also leaves them feeling soft and smooth.																								 							【Satisfaction Guarantee】: We're proud of our products. If you aren't satisfied, we'll refund you for any reason within three month of purchase. Only on WQIY Brand.",https://images-na.ssl-images-amazon.com/images/I/41Uf1aJ6YpL._AC_US40_.jpg
Made in USA Waterless Hand Disinfectant Cleaning Gel 8 fl oz Bottles,$15.00 ,"Waterless Hand Cleaner Contains Aloe																								 							ships from USA Made in USA																								 							Lemongrass Oil,Aloe ,Vitamin E rub through your palms until dry																								 							due to high demand cap is either Disc Top Caps or Pumps depending on availability																								 							70% Ethyl Alcohol",https://images-na.ssl-images-amazon.com/images/I/416pGsGgOmL._SS40_.jpg
