name,price,description,imgurl
Jacktom 60ml Disposable Hand Sa.nit/izer Gel Rinse Free 75 Alcohol Quick Drying Hand Soap for Home and Travel,,"This fits your .             Make sure this fits                by entering your model number.            P.when(""ReplacementPartsBulletLoader"").execute(function(module){ module.initializeDPX(); })																 							Convenient Design: 75% alcohol , and the hand san.itizer is non-toxic, non-irritating, and does not hurt hands.																								 							Gel Texture: The hand soap features gel texture for easy volume co trol. Small size for easy carrying.																								 							Moisturizing Function: The hand san.iti.zer can effectively and quickly kill microorganisms, etc., delicate and non-irritating, and it does not hurt the skin and comes with waterproof and moisturizing function.																								 							Easy to Use: Put some gel on your palm, then spread your hands thoroughly without rubbing with water or towels until the skin is dry.																								 							Wide Application: Suitable for office, home, car, school, or other places where you need to clean your hands quickly.",https://images-na.ssl-images-amazon.com/images/I/41cztMCSBgL._AC_US40_.jpg
"Hand Sanitizer Dispenser Floor Stand, Including Automatic Touchless Hand Sanitizer Dispenser",,"This fits your .             Make sure this fits                by entering your model number.            P.when(""ReplacementPartsBulletLoader"").execute(function(module){ module.initializeDPX(); })																 							90% Usa Steel, 10% Plastic																								 							Made in USA																								 							High Capacity---1000 ml (33 oz) with controllable discharge frequency (Sanitizer Solution NOT INCLUDED)																								 							Universal Canister & Sanitizer---Universal self filling canister; DOES NOT require any specific solution bag; Works with any liquid sanitizer and any brand																								 							Hygiene---Automatic infrared sensor technology provides quick sanitizer delivery without touching the dispenser																								 							Long Battery Life---55,000 single uses (4 “C” batteries required, NOT included)																								 							Industrial Grade---Heavy duty stand, proudly MADE IN TEXAS, USA (CUSTOM DESIGNS AVAILABLE)",https://images-na.ssl-images-amazon.com/images/I/41PgwzNnWIL._AC_US40_.jpg
"Funic Refreshing Hand Sanitizer Gel, Washless Hand Soap Gel, Super-Large Capacity Household Cleaning Gentle Hydrating Hand Sanitizer Soothing Gel,Non-irritating,Pump Bottle60ml",,"【99.99% Effective】--- This hand sanitizer is the perfect solution for hand hygiene at home, the office, medical facilities or while you travel. It stops the transition of dirty stuff and cleanses your skin.Kills more than 99.99%																								 							【Disposable Hand Sanitizer】--- The hand cleaner is an Non-irritating Refreshing Hand Sanitizer that kills dirty stuff on contact! This clearner formula stops the spread of dirty stuff to keep your family safe. Safe for babies.																								 							【Moisturizing Function】--- Gentle and non-irritating, does not hurt the skin, moisturizing your hand skin.																								 							【Rinse-Free】--- With this no rinse hand sanitizer, you don't need to wash your hands at all, and you can use it on the go! Better yet, it won’t leave a sticky or tacky residue like other hand sanitizers.																								 							【Good for Your Health】 - None of the nasty chemicals you find in conventional hand sanitizers, but just as effective!Alcohol free hand sanitizer disinfectant, protecting your from harmful, it also leaves them feeling soft and smooth.",https://images-na.ssl-images-amazon.com/images/I/31HzDZ4QJ0L._SS40_.jpg
"NxN Beauty Advanced Hand Sanitizer Refreshing Gel, With 70% Alcohol, 12 OZ (354ml) Each - Pack of 3",$39.00 ,"12 FL Oz (100ml) Each, Pack of 3																								 							Advanced Hand Sanitizer Alcohol Based (70%)																								 							Kills 99.9% of Germs																								 							Unscented Refreshing Gel Leaves Hands Feeling Soft",https://images-na.ssl-images-amazon.com/images/I/41BoPTLudLL._SS40_.jpg
MNLOS Hand Sanitizer Scented Liquid Soap Refreshing Degerming Hand Sanitizer Natural Hand Sanitizer,,"【99.99% Effective】--- This hand sanitizer is the perfect solution for hand hygiene at home, the office, medical facilities or while you travel. It stops the transition of dirty stuff and cleanses your skin.Kills more than 99.99%																								 							【Disposable Hand Sanitizer】--- The hand cleaner is an Non-irritating Refreshing Hand Sanitizer that kills dirty stuff on contact! This clearner formula stops the spread of dirty stuff to keep your family safe. Safe for babies.																								 							【Moisturizing Function】--- Gentle and non-irritating, does not hurt the skin, moisturizing your hand skin.																								 							【Rinse-Free】--- With this no rinse hand sanitizer, you don't need to wash your hands at all, and you can use it on the go! Better yet, it won’t leave a sticky or tacky residue like other hand sanitizers.																								 							【Good for Your Health】 - None of the nasty chemicals you find in conventional hand sanitizers, but just as effective!Alcohol free hand sanitizer disinfectant, protecting your from harmful, it also leaves them feeling soft and smooth.",https://images-na.ssl-images-amazon.com/images/I/41TY8rKPpuL._SS40_.jpg
Liquid Hand Soap Portable No-wash Hand Sanitizer Portable Quick-drying Hand Cleaning Lotion Baby Kids Adult,,"❤ It is important to Keep hands clean to protect your health																								 							❤ The hand sanitizer can always make your hands clean.																								 							❤ Hand sanitizer will keep your hands clean and at the same time emit a great smell. It is portable for you take it to travel or outdoor hiking. It is harmless for your skin.																								 							❤ Use it in the office, home, car, school or other places where you need to clean your hands quickly.","https://images-na.ssl-images-amazon.com/images/I/41W0vxgLTRL._AC_SR38,50_.jpg"
"TianWlio Refreshing Hand Sanitizer Gel, Washless Hand Soap Gel, Super-Large Capacity Household Cleaning Gentle Hydrating Hand Sanitizer Soothing Gel,Non-irritating,Pump Bottle 240ml",,"99.99% Effective:This hand sanitizer is the perfect solution for hand hygiene at home, the office, or while you travel. It stops the transition of dirty stuff and cleanses your skin.Kills more than 99.99%																								 							Moisturizing Function: Perfect for frequent use. Mild formula is free of parabens, phthalates, preservatives and harsh ingredients; so it does not dry out or irritate skin. Hands feel soft, even after many uses.																								 							Super-large Capacity Hand Sanitizer: super-large capacity hand sanitizer for household use, can be packed in a separate container and then packed into a backpack for easy carrying.																								 							Rinse-Free:With this no rinse hand sanitizer, you don't need to wash your hands at all, and you can use it on the go! Better yet, it won’t leave a sticky or tacky residue like other hand sanitizers.																								 							Good for Your Health:None of the nasty chemicals you find in conv",https://images-na.ssl-images-amazon.com/images/I/41Rqs4l2pTL._SS40_.jpg
"Comix Travel Size Hand Sanitizer Gel (2 Pack x 3.16 Fl Oz /95ml, Free Foaming Hand Sanitizer, No Rinse Foam Hand Soap Gel, Kid Friendly, L901-2 Pack",$11.59 ,"Comix Travel Size Hand Sanitizers Gel 3.16FL OZ/95ml L901 - 2 Pack																								 							With this no rinse hand sanitizer, you don't need to wash your hands at all, and you can use it on the go! Better yet, it won’t leave a sticky or tacky residue like other hand sanitizers.																								 							Perfect for frequent use. Mild formula is free of parabens, phthalates, preservatives and harsh ingredients; so it does not dry out or irritate skin. Hands feel soft, even after many uses.																								 							This size is perfect for putting in your pockets, bags and purses while traveling. It can be used for moisturizing water, hair gel, eyeglass cleaner, perfume, air freshener, and is very suitable for any business trip or holiday trip, children camping, outdoor activities, etc.																								 							Ship from China and pls kindly pay attention this hand sanitizer smell is pure Alcohol, no any other fragrance. Please do NOT buy if with Alcohol Allergic or ""don't like this smell""",https://images-na.ssl-images-amazon.com/images/I/41rJf5icEeL._SS40_.jpg
"Toamen Hand Sanitizer Gel Travel Size No-Rinse Effective 99.99% Skin Cleansing, Washless Hand Soap Gel 100ML, Portable Household Gentle Hydrating Cleaning Hand Sanitizer Non-irritating (3 Pcs)",,"This fits your .             Make sure this fits                by entering your model number.            P.when(""ReplacementPartsBulletLoader"").execute(function(module){ module.initializeDPX(); })																 							Package contains: 2/3 x 100ml hand sanitizer.																								 							INSTANT SANITIZER. This hand santizer quickly and effectively clean your hands without irritating or drying your skin.																								 							Effectively keeps your hands clean and at the same time emit a fresh smell, making your hands feel smooth and fresh.																								 							Use it in the office, home, car, school or other places where you need to clean, it is a portable hand sanitizer for you, very easy to carry out.																								 							Please do not hesitate to contact Toamens with any problems, we provide 24/7 responsive customer service. More products please pay attention to Toamens.",https://images-na.ssl-images-amazon.com/images/I/41jnQ7MIXTL._AC_US40_.jpg
"Beppter 50/100/150ml Water-Free Hand Sanitizer, Hand Sanitizer Travel Size, Hand Soap - Defense 24 Hours",,"➤➤Faster logistics, can be reached in 7-15 days.																								 							➤➤Small size, easy to carry.																								 							➤➤Maintaining clean hands is very important.																								 							➤➤The hand sanitizer will leave your hands clean while smelling great.																								 							➤➤Use it at your office, home, in your car, school or anywhere else you need to quickly clean your hands.","https://images-na.ssl-images-amazon.com/images/I/414kyBcjhmL._AC_SR38,50_.jpg"
"Kukakoo 5 PCS Refreshing Instant Hand Sanitizer Gel，Washless Hand Soap Gel,Non-irritating,Pump Bottle, Kid Friendly丨30ml Portable No Rinse Hand Sanitizer Cleaning Gel 30ml",,"【99.99% Effective】--- This hand sanitizer is the perfect solution for hand hygiene at home, the office, or while you travel. It stops the transition of dirty stuff and cleanses your skin.Kills more than 99.99%																								 							【MOISTURIZING & GENTLE & REFRESHING】--This hand sanitizers is a moisturizing foam that leaves your hands soft, smooth and maintains your skin’s natural pH; the hand sanitizer gel also doesn't leave any gel residue (which could actually attract more germs) like conventional gel sanitizers do.																								 							【EASY TO CARRY】--- This mini hand sanitizer is small size, easy to carry.Gel texture,you can easily control the amount.The Hand Sanitizer Gel is perfect for all occasions, this Hands Sterilizer Gel is convenient and easy to use. These size bottles are perfect and practical to carry in school bags, bags, travel bags, etc																								 							【Good for Your Health】 - None of the nasty chemicals you find in conventional hand sanitizers, but just as effective! protecting your from harmful, it also leaves them feeling soft and smooth.																								 							【HAND SANITIZER BULK】: Stock up on pump bottles to keep at desks, in kitchens and common areas; get the travel bottles for your purse, first aid kits, gym bag, or backpack; or get a supply of refill bags for your dispensers at hospitals, business and businesses.",https://images-na.ssl-images-amazon.com/images/I/41BkMmqkmLL._AC_US40_.jpg
"Fitfulvan Refreshing Hand Sanitizer Gel, Washless Hand Soap Gel, Super-Large Capacity Household Cleaning Gentle Hydrating Hand Sanitizer Soothing Gel,Non-irritating,Pump Bottle, 2PCs/60 ML",,"☞This Hand Santizer Gel Quickly and Effectively Clean Your Hands Without Irritating or Drying Your Skin.																								 							☞Moisturizing with Vitamin E																								 							☞Effectively keeps your hands clean and at the same time emit a fresh smell.																								 							☞Great alternative when soap and water are not available																								 							☞This Hand sanitizer will make your hands feel smooth and fresh.Put it in your pockets for on-the-go hand sanitization.",https://images-na.ssl-images-amazon.com/images/I/414Ahj6x-4L._SS40_.jpg
"WQIY Hand Sanitizer, Hand Soap Antibacterial",,"【Usage】: squeeze proper amount of hand washing liquid into the palm, rub your hands together until your hands dry, and do not need to rinse with water.																								 							【99.99% Effective】--- This hand sanitizer is the perfect solution for hand hygiene at home, the office, or while you travel. It stops the transition of dirty stuff and cleanses your skin.Kills more than 99.99%																								 							【Moisturizing Function】--- Perfect for frequent use. Mild formula is free of parabens, phthalates, preservatives and harsh ingredients; so it does not dry out or irritate skin. Hands feel soft, even after many uses.																								 							【Good for Your Health】 - None of the nasty chemicals you find in conventional hand sanitizers, but just as effective! protecting your from harmful, it also leaves them feeling soft and smooth.																								 							【Satisfaction Guarantee】: We're proud of our products. If you aren't satisfied, we'll refund you for any reason within three month of purchase. Only on WQIY Brand.",https://images-na.ssl-images-amazon.com/images/I/41SKJZi6GJL._AC_US40_.jpg
"CGKUITER Refreshing Hand Sanitizer Gel, Washless Hand Soap Gel, Capacity Household Cleaning Gentle Hydrating Hand Sanitizer Soothing Gel,Non-irritating,Pump Bottle 50ml+260ml",,"【99.99% Effective】--- This hand sanitizer is the perfect solution for hand hygiene at home, the office, medical facilities or while you travel. It stops the transition of dirty stuff and cleanses your skin.Kills more than 99.99%																								 							【Rinse-Free】--- With this no rinse hand sanitizer, you don't need to wash your hands at all, and you can use it on the go! Better yet, it won’t leave a sticky or tacky residue like other hand sanitizers.																								 							【Disposable Hand Sanitizer】--- The hand cleaner is an Non-irritating Refreshing Hand Sanitizer that kills dirty stuff on contact! This clearner formula stops the spread of dirty stuff to keep your family safe. Safe for babies.																								 							【Good for Your Health】 - None of the nasty chemicals you find in conventional hand sanitizers, but just as effective!Alcohol free hand sanitizer disinfectant, protecting your from harmful, it also leaves them feeling soft and smooth.																								 							【Moisturizing Function】--- Gentle and non-irritating, does not hurt the skin, moisturizing your hand skin.",https://images-na.ssl-images-amazon.com/images/I/414jVLGdMoL._SS40_.jpg
"Fitfulvan Refreshing Hand Sanitizer Gel, Washless Hand Soap Gel, Household Cleaning Gentle Hydrating Hand Sanitizer Soothing Gel,Non-irritating, Effective 99.9% Skin Cleansing, 2PC 200ML",,"This fits your .             Make sure this fits                by entering your model number.            P.when(""ReplacementPartsBulletLoader"").execute(function(module){ module.initializeDPX(); })																 							☞This Hand Santizer Gel Quickly and Effectively Clean Your Hands Without Irritating or Drying Your Skin.																								 							☞Moisturizing with Vitamin E																								 							☞Effectively keeps your hands clean and at the same time emit a fresh smell.																								 							☞Great alternative when soap and water are not available																								 							☞This Hand sanitizer will make your hands feel smooth and fresh.Put it in your pockets for on-the-go hand sanitization.",https://images-na.ssl-images-amazon.com/images/I/41yzNJZHIDL._AC_US40_.jpg
VEKDONE 300ML Hand Sanitizer Washless Hand Soap Large Capacity Household Cleaning Portable Pump Bottle No-wash Cleaner Hand Soap (300ML),,"☛Size:300 ML.Small size, easy to carry.																								 							☛Maintaining clean hands is very important.Hand sanitizer will make your hands feel smooth and fresh.																								 							☛The hand sanitizer will leave your hands clean while smelling great.																								 							☛Use it in the office, home, car, school or other places where you need to clean your hands quickly.																								 							☛How to use: crowd an appropriate amount of hand sanitizer into the palm of your hand and rub it together until your hands are dry, without washing with water.",https://images-na.ssl-images-amazon.com/images/I/41aBUKolgPL._SS40_.jpg
"Fitfulvan Refreshing Hand Sanitizer Gel, Washless Hand Soap Gel, Household Cleaning Gentle Hydrating Hand Sanitizer Soothing Gel,Non-irritating, Effective 99.9% Skin Cleansing, 300ML",,"This fits your .             Make sure this fits                by entering your model number.            P.when(""ReplacementPartsBulletLoader"").execute(function(module){ module.initializeDPX(); })																 							☞This Hand Santizer Gel Quickly and Effectively Clean Your Hands Without Irritating or Drying Your Skin.																								 							☞Moisturizing with Vitamin E																								 							☞Effectively keeps your hands clean and at the same time emit a fresh smell.																								 							☞Great alternative when soap and water are not available																								 							☞This Hand sanitizer will make your hands feel smooth and fresh.Put it in your pockets for on-the-go hand sanitization.",https://images-na.ssl-images-amazon.com/images/I/41w10gSkOeL._AC_US40_.jpg
"AIEason Refreshing Hand Sanitizer Gel, Washless Hand Soap Gel, Capacity Household Cleaning Gentle Hydrating Hand Sanitizer Soothing Gel,Non-irritating,Pump Bottle 5PC/60ml Green",,"【99.99% Effective】--- This hand sanitizer is the perfect solution for hand hygiene at home, the office, medical facilities or while you travel. It stops the transition of dirty stuff and cleanses your skin.Kills more than 99.99%																								 							【Disposable Hand Sanitizer】--- The hand cleaner is an Non-irritating Refreshing Hand Sanitizer that kills dirty stuff on contact! This clearner formula stops the spread of dirty stuff to keep your family safe. Safe for babies.																								 							【Moisturizing Function】--- Gentle and non-irritating, does not hurt the skin, moisturizing your hand skin.																								 							【Rinse-Free】--- With this no rinse hand sanitizer, you don't need to wash your hands at all, and you can use it on the go! Better yet, it won’t leave a sticky or tacky residue like other hand sanitizers.																								 							【Good for Your Health】 - None of the nasty chemicals you find in conventional hand sanitizers, but just as effective!Alcohol free hand sanitizer disinfectant, protecting your from harmful, it also leaves them feeling soft and smooth.",https://images-na.ssl-images-amazon.com/images/I/41HQU4jl3aL._SS40_.jpg
"MNLOS Refreshing Hand Sanitizer Gel, Washless Hand Soap Gel, Capacity Household Cleaning Gentle Hydrating Hand Sanitizer Soothing Gel,Non-irritating,Pump Bottle 5pc/60ml/rd",,"【99.99% Effective】--- This hand sanitizer is the perfect solution for hand hygiene at home, the office, medical facilities or while you travel. It stops the transition of dirty stuff and cleanses your skin.Kills more than 99.99%																								 							【Disposable Hand Sanitizer】--- The hand cleaner is an Non-irritating Refreshing Hand Sanitizer that kills dirty stuff on contact! This clearner formula stops the spread of dirty stuff to keep your family safe. Safe for babies.																								 							【Moisturizing Function】--- Gentle and non-irritating, does not hurt the skin, moisturizing your hand skin.																								 							【Rinse-Free】--- With this no rinse hand sanitizer, you don't need to wash your hands at all, and you can use it on the go! Better yet, it won’t leave a sticky or tacky residue like other hand sanitizers.																								 							【Good for Your Health】 - None of the nasty chemicals you find in conventional hand sanitizers, but just as effective!Alcohol free hand sanitizer disinfectant, protecting your from harmful, it also leaves them feeling soft and smooth.",https://images-na.ssl-images-amazon.com/images/I/41ZnuoMT7LL._SS40_.jpg
"Whear Travel Size Hand Sanitizer Gel,Portable Alcohol-Free No Rinse Hand Soap Gel,Wash-Free Cleaner Hydrating Hand Sanitizer Soothing Gel(5PCSx60ML)",,"This fits your .             Make sure this fits                by entering your model number.            P.when(""ReplacementPartsBulletLoader"").execute(function(module){ module.initializeDPX(); })																 							ி【Protection Function】-- This hand sanitizer is the perfect solution for hand hygiene at home, the office, or while you travel. It stops the transition of dirty stuff and cleanses your skin.Kills more than 99.99%.																								 							ி【Moisturizing Function】-- Perfect for frequent use. It does not dry out or irritate skin. Hands feel soft, even after many uses.																								 							ி【Rinse-Free】-- With this no rinse hand Gel, you don't need to wash your hands at all, and you can use it on the go! Better yet, it won’t leave a sticky or tacky residue like other hand Gel.																								 							ி【Good for Your Health】 - None of the nasty chemicals you find in conventional hand Gel, but just as effective! protecting your from harmful, it also leaves them feeling soft and smooth.																								 							ி【Quality Service】- Please read the size details carefully before ordering, If you have any problems, please send a message to us, We will answer your questions within 24 hours.",https://images-na.ssl-images-amazon.com/images/I/417YD18QcnL._AC_US40_.jpg
"Whear 60ml Pocket Size Hand Sanitizer Gel Refreshing Instant Hand Soap Gel,Portable Moisturizing Hand Sanitizer Soothing Gel,Non-irritating,Travel Size (1/2/4-pack) (B(2pc))",,"This fits your .             Make sure this fits                by entering your model number.            P.when(""ReplacementPartsBulletLoader"").execute(function(module){ module.initializeDPX(); })																 							ி【Protection Function】This hand sanitizer is the perfect solution for hand hygiene at home, the office, or while you travel. It stops the transition of dirty stuff and cleanses your skin.Kills more than 99.99%.																								 							ி【Moisturizing Function】Perfect for frequent use. It does not dry out or irritate skin. Hands feel soft, even after many uses.																								 							ி【Rinse-Free】With this no rinse hand Gel, you don't need to wash your hands at all, and you can use it on the go! Better yet, it won’t leave a sticky or tacky residue like other hand Gel.																								 							ி【Good for Your Health 】None of the nasty chemicals you find in conventional hand Gel, but just as effective! protecting your from harmful, it also leaves them feeling soft and smooth.																								 							ி【Quality Service】Please read the size details carefully before ordering, If you have any problems, please send a message to us, We will answer your questions within 24 hours.",https://images-na.ssl-images-amazon.com/images/I/419IVTiwfmL._AC_US40_.jpg
