name,price,description,imgurl
Boomer Naturals Refreshing Gel Hand Sanitizer,,"Help keep your family and household healthy with Boomer Naturals Refreshing Gel Hand Sanitizer.																								 							We know that washing your hands with soap and water isn’t always an option, and our easy-to-use sanitizer is ideal for use at home, in the workplace, in the car, or on the go. No rinsing or drying needed!																								 							Because up to 80% of all infections are transmitted by hands, using our antimicrobial gel sanitizer frequently throughout the day can significantly reduce your risk of illness.																								 							Kills more than 99.9% of germs, lowering risk of infections																								 							Refreshing gel fights germs and leaves hands feeling soft; Aloe Vera and Vitamin E keep your skin feeling smooth. MADE IN USA!",https://images-na.ssl-images-amazon.com/images/I/31DFLQ0S6PL._SS40_.jpg
"Hand Sanitizer Gel, DKEnjoy 16.9 Fl Oz /500ml Washless Hand Soap Gel, Antibacterial & Kills 99.99% of Germs, Alcohol-Free Disinfecting Cleaner No Rinse Free Foaming Hand Soap",,"99.99% Effective--- This hand sanitizer is the perfect solution for hand hygiene at home, the office, or while you travel. It stops the transition of dirty stuff and cleanses your skin. Kills more than 99.99% Germs.																								 							Moisturizing Function--- Perfect for frequent use. Mild formula is free of parabens, phthalates, preservatives and harsh ingredients; so it does not dry out or irritate skin. Hands feel soft, even after many uses.																								 							Rinse-Free--- With this no rinse hand sanitizer, you don't need to wash your hands at all, and you can use it on the go! Better yet, it won’t leave a sticky or tacky residue like other hand sanitizers.																								 							Easy to Use --- Just apply it, let it dry a few seconds and enjoy this excellent product! No water or towels needed.																								 							Good for Your Health --- None of the nasty chemicals you find in conventional hand sanitizers, but just as effective! protecting your from harmful, it also leaves them feeling soft and smooth.",https://images-na.ssl-images-amazon.com/images/I/41atiq-I0nL._SS40_.jpg
XIDAJIE 10Pack Cartoon Silicone Hand Sanitizer Holder 30 ML Reusable Liquid Soap Detachable Bottles Keychain Carriers Kids Travel Bottles Random Color Owl Dinosaur,,"This fits your .             Make sure this fits                by entering your model number.            P.when(""ReplacementPartsBulletLoader"").execute(function(module){ module.initializeDPX(); })																 							Design - Unique colored package design, will attract the attention of the child. Perfectly portable on-the-go companions, made with ultra durable material to last a while.																								 							Material - Extremely lightweight, compression impact, especially the choice of food-grade silicone material+PP material, there is not an ordinary silicone material , super resilience and wear lightweight, waterproof , travel more easily																								 							Easy To Carry - Throw it in your purse, backpack, briefcase, beach bag and always have a way to keep your hands clean.Perfect for sharing or giving as a gift.																								 							Pacakge include - 30ml capacity.easy to clean. 10PCS Hand sanitizer Holder £¨Without Liquid£																								 							Easily attaches to your backpack, stroller, gym bag, key ring and more!",https://images-na.ssl-images-amazon.com/images/I/51gezqh%2BQzL._AC_US40_.jpg
"Organic Chix Powerful Natural Hand Sanitizer - Made in USA, Ecofriendly Antibacterial Sanitizer from Pure Plant Based Essential Oils - Protects from Germs & Defends Immune System (16oz Eco Pouch)",,"ALCOHOL FREE: Plant-based ingredients you can pronounce! Witch Hazel, Vitmain E & Organic Chix Proprietary Germ Defense Essential Oil Blend. No alcohol, industrial synthetic agents, harmful preservatives or binders.																								 							DEFEND YOUR IMMUNE SYSTEM: Organic Chix proprietary blend protects & defends against airborne germs to keep you healthy.																								 							STAY SAFE: Protect against germs without resorting to harmful toxins through our independently labratory tested germ defense blend. Organic Chix non-GMO proprietary blend is baby safe, food safe, kid safe, pet safe & skin safe!																								 							HANDMADE IN THE USA: Made in the USA from start to finish, Organic Chix is quality controlled every step of the process. Premium ingredients, ethically sourced, and supporting small eco-friendly business.																								 							INSTRUCTIONS: Step One - Fill spray bottle of your choice from ecofriendly refill pouch. Step Two - Spray on hands and rub in. Step Three - Enjoy! Be Clean, Stay Healthy, Stay Safe!",https://images-na.ssl-images-amazon.com/images/I/31Ff4Yxnt6L._AC_US40_.jpg
Hand Sanitizer Gel Liquid No-wash Hand Soap Hand Cream Portable No-wash 80ML/100ML Free Foaming Hand Sanitizer Pump No Rinse Safe & Health Hand Soap Gel Clear 100ml,,"❥❥【Function】- It can effectively and quickly kill microorganisms etc.Delicate and non-irritating, it does not damage the skin, it has a water-repellent and moisturizing function.																								 							❥❥【Features】- Gel texture, you can easily control the quantity.																								 							❥❥【How to Use】- Put some gels on your palms and thoroughly spread on both hands, without water or towel, rub into skin until dry.																								 							❥❥【Applications】- Use it in the office, home, car, school or other places where you need to clean your hands quickly.																								 							❥❥【Note】- For external use only! Not eating! Keep out of children! please cautions!",https://images-na.ssl-images-amazon.com/images/I/41Ju69CLSbL._AC_US40_.jpg
Instant Hand Sanitize Gel - Value Size Advanced Natural Hand Sanitize Cleaner Portable Aloe Vera Moisturizer Packaging May Vary (5 Pack (5 X 4 oz)),$38.95 ,,https://images-na.ssl-images-amazon.com/images/I/41iCjkR3vKL._SS40_.jpg
"Hand soap/sanitizer automatic dispenser floor stand, universal, blk powder coated, adjustable height",,"Commercial grade metal fabrication with black powder coated finish, adjustable height, weight base for stability",https://images-na.ssl-images-amazon.com/images/I/31H0qHbPwhL._SS40_.jpg
Refreshing Hand Sanitizer Gel Washless Hand Soap Gel Pump Bottle Home Cleaning Hydrating Hand Sanitizer Soothing Non-irritating Super-Large Capacity 480ML,,"This fits your .             Make sure this fits                by entering your model number.            P.when(""ReplacementPartsBulletLoader"").execute(function(module){ module.initializeDPX(); })																 							75% Ethanol Kills germs 99%,keeping your hands hygienic at home, office or on the way																								 							Kills germ/Water free/ Hypoallergenic/ Non-sticky/No foam / Rapid drying/ Leaves skin feeling silky soft, dry and free																								 							Moisturizing function, it has very good moisturizing function																								 							Without washing, do not need to wash with water and It does not leave a sticky or sticky residue like other hand sanitizers																								 							Family /School/Hospital/Hotel/Amusement park/Pet agency/Beauty agency																										                                 	                              																		›			See more product details",https://images-na.ssl-images-amazon.com/images/I/41Z7VJovtYL._AC_US40_.jpg
"WQIY Hand Sanitizer, Hand Soap Antibacterial, Mini Hand Sanitizer Anti-Bacteria Moisturizing Fruit-Scented Waterless Shampoo",,"【Usage】: squeeze proper amount of hand washing liquid into the palm, rub your hands together until your hands dry, and do not need to rinse with water.																								 							【99.99% Effective】--- This hand sanitizer is the perfect solution for hand hygiene at home, the office, or while you travel. It stops the transition of dirty stuff and cleanses your skin.Kills more than 99.99%																								 							【Moisturizing Function】--- Perfect for frequent use. Mild formula is free of parabens, phthalates, preservatives and harsh ingredients; so it does not dry out or irritate skin. Hands feel soft, even after many uses.																								 							【Good for Your Health】 - None of the nasty chemicals you find in conventional hand sanitizers, but just as effective! protecting your from harmful, it also leaves them feeling soft and smooth.																								 							【Satisfaction Guarantee】: We're proud of our products. If you aren't satisfied, we'll refund you for any reason within three month of purchase. Only on WQIY Brand.",https://images-na.ssl-images-amazon.com/images/I/41ON83Z34RL._AC_US40_.jpg
Antibacterial Hand Sanitizer Pump Gel - Alcohol 75% Large Hand Sanitizer 2 Pcs,,"Hand sanitizer gel with 75% alcohol, portable clear liquid soap, it has good sterilization performance, which can effectively kill 99.9% of germs, protect your safety and health.																								 							It can be used instant without water so that you can use it anytime and anywhere for disinfection.																								 							The ingredients are safe, quick-drying, mild and non-irritating, it is suitable for children and adults to use daily, it has a wide range of applications, suitable for cleaning hands, mobile phones, desktop and so on.																								 							This hand sanitizer gel is the perfect solution for hand hygiene at home, the office, medical facilities, shopping mall, hospital, restaurant, amusement park, pet's agency, school or while you traveling, hiking, camping, etc.																								 							Pure natural ingredients are gentle enough for children’s sensitive skin, while still killing germs.",https://images-na.ssl-images-amazon.com/images/I/51%2BQh0jcyYL._SS40_.jpg
Portable No-wash Quick-Drying Press Hand Sani-tizerSoothing Gel,,"Imported																								 							Kills 99.99% of many common harmful and bac-teria in as little as 15 seconds																								 							No-wash quick-drying / Hydrophilic emollient / Solubilizes lipophilic substances																								 							Press style makes it easier to use , Gives a dense, creamy foam																								 							Subtle and Refreshing Fragrance																								 							Content: 59ml","https://images-na.ssl-images-amazon.com/images/I/319IW-AZfpL._AC_SR38,50_.jpg"
"SmallYin Refreshing Hand Sanitizer Gel, Washless Hand Soap Gel, Super-Large Capacity Household Cleaning Gentle Hydrating Hand Sanitizer Soothing Gel,Non-irritating,Pump Bottle 300ml",$9.79 ,"99.99% Effective:This hand sanitizer is the perfect solution for hand hygiene at home, the office, or while you travel. It stops the transition of dirty stuff and cleanses your skin.Kills more than 99.99%																								 							Moisturizing Function: Perfect for frequent use. Mild formula is free of parabens, phthalates, preservatives and harsh ingredients; so it does not dry out or irritate skin. Hands feel soft, even after many uses.																								 							Super-large Capacity Hand Sanitizer: super-large capacity hand sanitizer for household use, can be packed in a separate container and then packed into a backpack for easy carrying.																								 							Rinse-Free:With this no rinse hand sanitizer, you don't need to wash your hands at all, and you can use it on the go! Better yet, it won’t leave a sticky or tacky residue like other hand sanitizers.																								 							Good for Your Health:None of the nasty chemicals you find in conv",https://images-na.ssl-images-amazon.com/images/I/41czkaOa-NL._SS40_.jpg
Plant Therapy Unscented Hand Sanitizer Spray 8 oz 4 Pack,,"99% EFFECTIVE AGAINS MOST COMMON GERMS: With 75% isopropyl alcohol, you can use our Unscented Hand Sanitizer Spray confidently knowing that this product was formulated to be effective against 99.9% of common germs when used as directed.																								 							QUICK DRYING FORMULA: This quick-drying formula contains no parabens, phthalates, synthetic fragrances, dyes, or artificial colors.																								 							BUY INDIVIDUALLY OR BUNDLE TOGETHER: Get extra savings when you bundle together! Available for purchase individually or as a bunlde of four.																								 							THE HIGHEST QUALITY: At Plant Therapy, our goal is to positively impact the lives of as many people as we possibly can, by selling such a high-quality product at an affordable price. Be confident knowing you are purchasing quality oils and body care at direct-to-consumer prices.																								 							CERTIFIED AROMATHERAPISTS ON STAFF: Our customers are our #1 priority and we’d love for you to join the Plant Therapy Family. Our Certified Aromatherapists are happy to help you with all of your questions. In addition, we offer a risk-free 100% satisfaction guarantee!",https://images-na.ssl-images-amazon.com/images/I/418sC1w7P3L._SS40_.jpg
"250ml / 500ml Disposable Hand Sanitizer, Disposable Hand Sanitizer, Free 75 Alcohol Hand Soap, Suitable for Families",,"99.99% effective rate: This hand sanitizer contains 75% alcohol, and it can prevent the transfer of dirty things and clean the skin. The kill rate exceeds 99.99%.																								 							Safety: This hand sanitizer is a non-irritating refreshing hand sanitizer that can kill dirty things when it comes into contact! This refreshing formula prevents the spread of dirt and guarantees the safety of your family. Babies can also use it with confidence.																								 							Free-rinse: With this free-rinse hand sanitizer, you don’t need to wash your hands at all. You can use it at any time! Even better, it does not leave sticky or sticky residue like other hand sanitizers.																								 							Large capacity: The household large-capacity hand sanitizer can be packed in a separate container and then stored in a backpack for easy portability.																								 							Wide application: This hand sanitizer is the perfect solution for hand hygiene in homes, offices, medical places or travel.",https://images-na.ssl-images-amazon.com/images/I/41rs0s-a9HL._AC_US40_.jpg
500ML Disposable Hand Sanitizer Gel Liquid No-wash Hand Soap Hand Cream Portable No-wash Free Foaming Hand Sanitizer Pump No Rinse Safe & Health Hand Soap Gel Clear,,"✿【Function】- It can effectively and quickly kill microorganisms etc.Delicate and non-irritating, it does not damage the skin, it has a water-repellent and moisturizing function.																								 							✿【Features】- Gel texture, you can easily control the quantity.																								 							✿【How to Use】- Put some gels on your palms and thoroughly spread on both hands, without water or towel, rub into skin until dry.																								 							✿【Applications】- Use it in the office, home, car, school or other places where you need to clean your hands quickly.																								 							✿【Note】- For external use only! Not eating! Keep out of children! please cautions!",https://images-na.ssl-images-amazon.com/images/I/51hhIBR-OGL._SS40_.jpg
"Belleza Solution Hand Sanitizer Gel with 70% V/V Alchohol Based, Vitamin E & Mositurizers, Effective on 99.9% of Germs, 8.5 OZ (251 ml)",,"MADE IN THE USA - Our Belleza Solutions Hand Sanitizer is made in IOWA - USA.																								 							CONTAINS 70% ALCOHOL - Most Powderful Sanitizer - Kills 99.99 of Germs																								 							PRODUCT OF YOUR DESIRE - A must require product to kill germs to stop spreading flu & cold like illness.*																								 							Effective at eliminating more than 99.99% of many harmful germs and bacteria in as little as 15 seconds)																								 							GIVE IT A TRY - DO NOT DRY OUT OR IRRITATE TO YOUR SKIN - HANDS FEEL SOFT AFTER MULTIPLE USE - Our Belleza Hand Sanitizer is made with vitamin E is free of parabens, phthalates, preservatives;",https://images-na.ssl-images-amazon.com/images/I/41XmBzo96iL._SS40_.jpg
"(2Pack×16.9 Fl Oz/500ML）EG Refreshing Hand Sanitizer Gel, Washless Hand Soap Gel, Super-Large Capacity Household Cleaning Gentle Hydrating Hand Sanitizer Soothing Gel,Non-irritating,Pump Bottle (500 M",$40.30 ,"No washing, quick drying, easy to use, mild hand protection																								 							Gentle and non-irritating, does not hurt the skin, has water-holding and moisturizing function																								 							Remove 99.9% of harmful substances your family comes in contact with every day. Leaves a pleasant skin feel.																								 							Gel texture, you can easily check the quantity																								 							Please note that for international shipping 10-20 days, we will ship the package after it is completely cleaned, and the carrier will perform a second cleaning when the package is delivered",https://images-na.ssl-images-amazon.com/images/I/41ZxR9XIoVL._SS40_.jpg
"Portable Hand Disinfectant Sanitize Gel 8 Ounce - 70% Alcohol Advanced Formula Hand Sanitize Rinse Free, Waterless - No Sticky Residue - Kills 99.99% of Germs Instantly Made in USA",$14.99 ,"✅Kills 99.9% of germs without water, flushing free disinfection gel. It Can effectively and quickly kill germs, fungi, cocci, and viruses, etc. Gentle and non-irritating, does not hurt the skin, has water-holding and moisturizing function. This clearner formula stops the spread of dirty stuff to keep your family safe.																								 							✅Take an appropriate amount (2-3ml) of the product to moisten your hands and rub for 15 seconds until the liquid covers your hands, gently washing away dirt & germs, wait for drying, and do not wash with water. With this no rinse hand Disinfectant Sànitizer, you don't need to wash your hands at all, and you can use it on the go! Safe, without side effects																								 							✅Keep clean hands and health for kids. Better yet, it won’t leave a sticky or tacky residue like other hand Disinfectant Sànitizer. Make you easily can keep clean and tidy anytime and anywhere. It is an interesting washing product, environmental protection, travel products. A good partner for your health																								 							✅Gel texture, you can easily control the amount. The Hand Disinfectant Sànitizer Gel is perfect for all occasions, this Hands Sterilizer Gel is convenient and easy to use. These size bottles are perfect and practical to carry in school bags, bags, travel bags, etc																								 							✅Case Includes: 1X 8oz Hand Disinfectant Sànitizer with 70% ETHANOL( ethyl alcohol) - Made in USA",https://images-na.ssl-images-amazon.com/images/I/317UOoBitwL._SS40_.jpg
MacRoog 70ml Advanced Hand-Free Sanítízer Gel Hands Cleaner Hand Soap Easy Carry Soft Hands Gel Pocket Size for Adults Kids (A),,,https://images-na.ssl-images-amazon.com/images/I/41boKqTKufL._AC_US40_.jpg
Quick Drying Hand Sanitizer Rinse Free Hand Soap for Home Travel 500ml,,"This fits your .             Make sure this fits                by entering your model number.            P.when(""ReplacementPartsBulletLoader"").execute(function(module){ module.initializeDPX(); })																 							★CONTAINS 75% ETHYL ALCOHOL★: Kills 99.9% of germs. A must have for everyfamily.																								 							★SAFE FOR KIDS★: Pure natural ingredients are non-irritation and gentle enough for children's sensitive skin, while still killing germs.																								 							★QUICK DRYING★: No water needed. Air dries within seconds. Easy to keep hands clean. Gentle and non-irritatingn																								 							★BULK PACK★: 17.0 fl.oz per bottle. Great to be used at home, office, school or public places.																								 							★NOTE★: Children under 6 years of age should be supervised when using this product.																										                                 	                              																		›			See more product details",https://images-na.ssl-images-amazon.com/images/I/41EU-2i692L._AC_US40_.jpg
"2 Pcs Portable Hand Sanitizer - 50ml Travel Size Quick-Drying Liquid Hand Soap, Kills 99% of Germs, Suitable for Outdoor Camping Hiking Indoor Office Restaurant Hospital School",,"Lathering foam, Feel clean and fresh every day. pH-balanced with reliable protection.																								 							Leaves a pleasant skin feel. Gives a dense, creamy foam. Decreases irritation potential of surfactants.																								 							Better cleaning.Less rinsing needed due to lower surfactant.																								 							It is recommended to wash your hands frequently every day. You need to wash your hands when you go out or before meals.																								 							Tips: If you want more personal cleansing supplies, please visit our store GraPefruiT.",https://images-na.ssl-images-amazon.com/images/I/51tj5L1CiHL._AC_US40_.jpg
500 ml Hand W-ash Refreshing Sanit-izer Gel Washless Hand Soap Gel Gentle Hydrating Hand Sanitiz-er Non-irritating Pump Bottle 75% Al-cohol No Water Required,,"No washing, quick drying, easy to use, mild hand protection																								 							Gentle and non-irritating, does not hurt the skin, has water-holding and moisturizing function																								 							Gel texture, you can easily check the quantity																								 							It can effectively and quickly wash hands																								 							Package include: 1pc 500ml Disposable Hand Sanitizer Gel",https://images-na.ssl-images-amazon.com/images/I/31zOAIJi47L._SS40_.jpg
"ALIVER Instant Hand Sanitizer Alcohol Based (5 Pack),No Rinse Foam Hand Soap 50ml",,"Just apply evenly to your hands and no longer need to wash your hands with water.																								 							This hand sanitizer is so small and convenient that you can carry it anywhere and care for your hands.																								 							Keep your hands dry, clean and moisturizing",https://images-na.ssl-images-amazon.com/images/I/41YbXFNv1HL._SS40_.jpg
"Toamen Disposable Hand Sanitizer Gel Rinse-Free 300ML, Hand Soap Gel to Instant Skin Cleanser Non-irritating Hand Sanitizer Gel Effective 99.99% Skin Cleansing, Pump Bottle",,"This fits your .             Make sure this fits                by entering your model number.            P.when(""ReplacementPartsBulletLoader"").execute(function(module){ module.initializeDPX(); })																 							Package contains: 1 × 300ml hand sanitizer.																								 							INSTANT SANITIZER. This hand santizer quickly and effectively clean your hands without irritating or drying your skin.																								 							Effectively keeps your hands clean and at the same time emit a fresh smell, making your hands feel smooth and fresh.																								 							Use it in the office, home, car, school or other places where you need to clean, it is a portable hand sanitizer for you, very easy to carry out.																								 							Please do not hesitate to contact Toamens with any problems, we provide 24/7 responsive customer service. More products please pay attention to Toamens.",https://images-na.ssl-images-amazon.com/images/I/41aBUKolgPL._AC_US40_.jpg
"Pioneer Valley 8oz Hand Sanitizer, Unscented, pH ballanced",,"Large 8oz bottle of premium Unscented Hand Sanitizer, PH balanced to protect your skin. Added Carnuba and Bees wax to help protect your skin.																								 							70% premium cosmetic grade ethyl alcohol for maximum effectiveness (Ethyl alcohol = Ethanol) We do NOT use reagent grade which can be overly harsh on your skin. Note that because this is unscented and made of 70% alcohol, this has a strong alcohol odor.																								 							Made in the USA in an FDA inspected facility - ships within one day of purchase.																								 							Made with Nature Beads! The Nature Beads will loosen and open your skin enhancing the antisceptic properties of the ethenol. They also remind you to thoroughly rub your hands for about 10-15 seconds, after which the Nature Beads will magically disappear into your skin both softening your skin and adding an extra layer of protection.",https://images-na.ssl-images-amazon.com/images/I/318LCLPiZWL._SS40_.jpg
Instant Hand Sanitize Gel - Value Size Advanced Natural Hand Sanitize Cleaner Portable Aloe Vera Moisturizer 4 oz,,"KEEP YOUR HANDS CLEAN																								 							NON STICK FORMULA																								 							MADE IN USA",https://images-na.ssl-images-amazon.com/images/I/41C3UPX7STL._SS40_.jpg
